{
  "schema_version": 2,
  "task_id": "uigs-all-validated-legacy-claim-migration-2026-10-07",
  "goal": "Complete first-pass Claim/Evidence migration for every currently Validated legacy catalog record without widening semantics or fabricating provenance.",
  "status": "completed",
  "current_work_unit": null,
  "completed_units": [
    "merged validated migration wave 1",
    "migrated all remaining validated legacy Bug records",
    "preserved provenance lineage without inflating independent support",
    "linked every validated legacy Bug to its atomic Claim"
  ],
  "next_units": [
    "use epistemic migration report to prioritize Experimental knowledge only when evidence justifies promotion or claim-level modeling"
  ],
  "repository": "11576865/UIGS-Foundry",
  "branch": "main",
  "pull_request": 23,
  "last_durable_commit": "2b84fe48040d35ede919c2d360349cd07cc3cf43",
  "external_validation": {
    "ci": "passed",
    "merge": "passed"
  },
  "blockers": [],
  "notes": [
    "All currently Validated legacy catalog records now have first-pass Claim/Evidence representation.",
    "PR #23 content passed Validate Foundry before final replay; final replay onto current main had zero overlapping changed files with intervening main updates.",
    "PR #23 merged successfully after replay onto current main.",
    "No legacy record was promoted beyond Validated and no provenance was fabricated.",
    "This record is a completed milestone; the parent epistemic-rebase project remains independently gated."
  ],
  "updated_at": "2026-10-07T14:23:00+08:00",
  "level": "milestone",
  "project_id": "uigs-epistemic-rebase-project-2026-10-07",
  "parent_task_id": "uigs-epistemic-rebase-project-2026-10-07"
}
